{
  "$id": "ig://gate1/frozen-baseline-shape/IG_L16_SCOUT_EVIDENCE_CLAIM_BOUNDARY_V1",
  "$schema": "https://json-schema.org/draft/2020-12/schema",
  "additionalProperties": false,
  "properties": {
    "allowed_statements": {
      "items": {
        "type": "string"
      },
      "type": "array"
    },
    "boundary_sha256": {
      "type": "string"
    },
    "claim_records_created_by_this_run": {
      "items": {},
      "type": "array"
    },
    "evidence_tuple": {
      "items": {
        "type": "string"
      },
      "type": "array"
    },
    "forbidden_claims": {
      "items": {
        "type": "string"
      },
      "type": "array"
    },
    "historical_status": {
      "type": "string"
    },
    "promotion_semantics": {
      "additionalProperties": false,
      "properties": {
        "authority_upgrade": {
          "type": "boolean"
        },
        "carried_program_priority": {
          "type": "string"
        },
        "clarification": {
          "type": "string"
        },
        "current_level_relation_promotion": {
          "type": "string"
        }
      },
      "required": [
        "authority_upgrade",
        "carried_program_priority",
        "clarification",
        "current_level_relation_promotion"
      ],
      "type": "object"
    },
    "schema_id": {
      "const": "IG_L16_SCOUT_EVIDENCE_CLAIM_BOUNDARY_V1",
      "type": "string"
    }
  },
  "required": [
    "allowed_statements",
    "boundary_sha256",
    "claim_records_created_by_this_run",
    "evidence_tuple",
    "forbidden_claims",
    "historical_status",
    "promotion_semantics",
    "schema_id"
  ],
  "title": "Frozen v0.26 baseline shape for IG_L16_SCOUT_EVIDENCE_CLAIM_BOUNDARY_V1",
  "type": "object",
  "x-ig-baseline-version": "0.26.0",
  "x-ig-contract-status": "STRICT_FROZEN_BASELINE_SHAPE"
}
