{
  "allowed_statements": [
    "exact bounded counts for the pinned root panel",
    "tracked relation family persists/expands/refines/closes/reorganizes/combines/destroys-or-relieves within the declared bounded comparison",
    "recognition-only Spectroscope markers",
    "implementation agrees or disagrees with the historical science projection"
  ],
  "boundary_sha256": "917f3bbe3cbd3dd2d4c5a3fb4d5047502b1693d92c5b7cb95d15808453d05c75",
  "claim_records_created_by_this_run": [],
  "evidence_tuple": [
    "DIRECT_EXECUTION",
    "BOUNDED_PREREGISTERED",
    "OBSERVED",
    "RECONNAISSANCE_ONLY",
    "SCOUT_OBSERVED"
  ],
  "forbidden_claims": [
    "FIRST_OCCURRENCE",
    "C_PROVED",
    "POPULATION_WIDE_NEGATIVE",
    "MECHANISM",
    "GEOMETRY",
    "PHYSICAL_TOPOLOGY",
    "TRANSITION_LEVEL",
    "GRADUATION",
    "ROBUSTNESS_OR_REDUNDANCY_AS_ESTABLISHED_PHYSICS"
  ],
  "historical_status": "The historical L16 result already exists. The unified run is a direct replay/integration of that frozen bounded scope, not a blind first discovery.",
  "promotion_semantics": {
    "authority_upgrade": false,
    "carried_program_priority": "preserves unresolved/cumulative priority from the L15 baseline separately",
    "clarification": "These two fields are kept separate so the historical L16 per-relation TRACK_UPWARD value and the carried R_PARENT_FIBER maturation-review priority are both preserved without conflation.",
    "current_level_relation_promotion": "computed from each L16 relation record"
  },
  "schema_id": "IG_L16_SCOUT_EVIDENCE_CLAIM_BOUNDARY_V1"
}
